{
  "artifact_id": "01ARZ3NDEKTSV4RRFFQ69G5FAF",
  "type": "report",
  "name": "Quarterly Progress Report Q2 2026",
  "description": "Comprehensive report on project progress, findings, and next steps",
  "uri": "s3://rapai-bucket/reports/q2-2026/progress_report.pdf",
  "hash": "e3b0c44298fc1c149afbf4c8996fb92427ae41e4649b934ca495991b7852b855",
  "version": "1.0.0",
  "created_by_task_id": "01ARZ3NDEKTSV4RRFFQ69G5FA2",
  "created_by_person_id": "01ARZ3NDEKTSV4RRFFQ69G5FB3",
  "security_tier": "CONFIDENTIAL",
  "status": "published",
  "related_ip_ids": [],
  "created_at": "2026-04-20T14:30:00Z",
  "updated_at": "2026-04-21T10:00:00Z"
}
